Date,MBSPrefix,MapRef,Latitude,Longitude,Location,Country,Comments,Reason,Photo25-04-1945,rB,144041,53.13224,7.95209,Osterscheps,Germany,"The town of Osterscheps was taken by the Algonquins without a fight, but the Typhoons were kept busy until 24 April clearing the surrounding woods. The Germans made several counter-attacks to try to take back Osterscheps, initially over-running B Company at dawn on 24 Apr, but the position was retaken in a swift counter-thrust. The Argylls held the town, and the Lake Superiors pushed through and advanced. The Argylls then moved forward and other than some occasional shelling were out of the fight until 28 April . ",,30-04-1945,rB,161071,53.1591200,7.9776,Bad Zwischenahn,Germany,"On 30 April, the Argylls moved on Bad Zwischenahn meeting only light resistance, presenting a demand to surrender to the Germans that evening. They accepted the demand, and the town fell on 01 May. ",,02-05-1945,rB,173117,53.20036,7.99575,Rostrup,Germany,"The Argylls moved ahead on 02 and 03 May facing sufficient fire to limit their progress during the day. By 1400 on 04 May the town of Wiefelstede was taken with minimal resistance. They set out for Sphole, but were subject to mortar, artillery and sniper fire. They halted their attack to wait for night fall. They never got the order to advance as the Cease fire to end the war in Europe was called for 0800 05 May. The Argylls war was over. ",,04-05-1945,rB,253181,53.25748,8.11578,Wiefelstede,Germany,"They set out for Sphole, but were subject to mortar, artillery and sniper fire. They halted their attack to wait for night fall. They never got the order to advance as the Cease fire to end the war in Europe was called for 0800 05 May. The Argylls war was over. ",,12-05-1945,rB,126197,52.36797,6.45459,Nijverdal,Germany,"After the conflict was over, the Argylls moved to Nijverdal, Holland to wait for repatiriation. Since they were one of the later units to cross the Atlantic, they would be among the last to return. An individual points system was employed to permit members with extended times away from Canada to return first, so high points personnel were replaced by reinforcements, so members who had served in Jamacia, England then Europe were repatriated first. ",,19-06-1945,,,52.2432106,10.3765719,Braunschweig,Germany,"14 Officers and 235 OR of the Argylls were selectd for the Canadian Berlin Battalion, to be part of the victory parade.",,04-07-1945,rZ,770454,52.4807,13.28811,Berlin,Germany,"The troops paraded for the raising of the British Flag over Berlin on 04 July, flying proudly on the Flag Pole from the 1936 Olympic Stadium.  Prime Minister Winston Churchill, President Harry Truman and General Stalin arrived for the Big 3 conference. Although the original plan was to have a joint parade, likely because the Russian soldiers were fighters and not well-trained in parade ground activities, it was decided to have separate parades for the 3 forces. On 21 July 1945, one year exactly after the Argylls had landed in Normany, the Canadians paraded with the British, reviewed by Winston Churchill, General Montgomery, US General Marshall and Admiral King, French Brigadeer de Beauchesne and Russian General Gorbatov. ",,28-07-1945,rV,126197,52.36797,6.45459,Nijverdal,Netherlands,"Back in Nijverdal on 12 August, the Argylls had a memorial service for the 27 officers and 240 Other ranks killed in service, and the 51 Officers and 829 Other Ranks wounded in action.",,24-09-1945,rx,243064,52.22826,5.16617,Hilversum,Netherlands,"The Argylls also took part in the celebrations of the anniversary of liberation of Selzate, Belgium on 18 September 1945, and the liberation of Bergen Op Zoom on 27 October 1945. ",,27-10-1945,qD,604276,51.4977300,4.2850500,Bergen Op Zoom,Netherlands,"Sports, Education",,28-10-1945,rx,243064,52.22826,5.16617,Hilversum,Netherlands,"On 24 September the Argylls moved to Hilvesum, Netherlands and in late December the Battalion moved through Nijmegen then to Ostende to return to England. ",,29-01-1946,,,43.2611005,-79.8669426,Hamilton,Canada,"On 21 Janaury 1946 the Argylls moved to Southampton then sailed home for Canada on the Ile de France. They docked in Halifax on 27 January, and boarded the train for Hamilton. They exited the train on 29 January and were greeted by the 2nd Battalion Argylls and thousands of cheering spectators. They paraded to the Armouries through the heart of the city between cheering crowds and showers of ticker tape and confetti. The families of the Argylls were all waiting at the Armoury and the long service of the Argylls came to an end with the command:
“1st Battalion, The Argyll and Sutherland Highlanders of Canada, DISMISS!”",,
